text,createTime,createTimeISO,isAd,profileUrl,musicName,musicId,webVideoUrl,duration,diggCount,shareCount,playCount,collectCount,commentCount,hashtags,isSlideshow,isSponsored,kol_username,ttSeller,commerceUser,is_trending,emoji_count,hashtag_count,word_count_no_emoji_hashtag,early_morning,morning,afternoon,evening,late_night,is_weekend,is_pinned
1 em toning pad đa công dụng rất nên thử nè @OHUI #ohuivietnam #miracletoning #toningpad #learnontiktok #learnontiktok #goclamdep #reviewlamdep #kbeauty ,2024-07-30 21:39:08,30/07/2024,False,https://www.tiktok.com/@khietnhinhi,original sound - khietnhi,7397438427132283665,https://www.tiktok.com/@khietnhinhi/video/7397438405392469266,54,128,30,12000,28,0,", ohuivietnam, miracletoning, toningpad, learnontiktok, learnontiktok, goclamdep, reviewlamdep, kbeauty",False,False,khietnhinhi,False,False,False,0,8,12,0,0,0,1,0,0,False
#gifted_by_officialmedik8 #medik8 #medik8 #liquidpetides Have you try this age-defying liquid peptides by medik8 @Medik8 ,2024-07-30 13:10:04,30/07/2024,False,https://www.tiktok.com/@khietnhinhi,supernatural,7343862682463816481,https://www.tiktok.com/@khietnhinhi/video/7397307208603602194,22,103,7,12500,30,8,"gifted_by_officialmedik8, medik8, medik8, liquidpetides, ",False,False,khietnhinhi,False,False,False,0,4,10,0,0,1,0,0,0,False
Cùng mình unbox túi quà siêu mê của nhà Freshian nhaaaa  #freshianvn #freshian #Thefaceshopvietnam #Thefaceshopcleanbeauty #reviewlamdep #goclamdep #LearnOnTiktok #reviewmypham ,2024-07-29 20:51:22,29/07/2024,False,https://www.tiktok.com/@khietnhinhi,original sound - khietnhi,7397055036222212865,https://www.tiktok.com/@khietnhinhi/video/7397055005661957394,53,227,13,15400,60,14,"freshianvn, freshian, thefaceshopvietnam, thefaceshopcleanbeauty, reviewlamdep, goclamdep, learnontiktok, reviewmypham",False,False,khietnhinhi,False,False,False,0,8,11,0,0,0,1,0,0,False
Mặt nạ lột mụn 😳😳 @APRILSKIN VIỆT NAM #APRILSKIN #APRILSKINPARTNER #kbeauty #aprilskin #beautytok #reviewlamdep #xuhuonglamdep #goclamdep #fyp #fyi #skincareroutine #ktrend ,2024-07-29 16:03:44,29/07/2024,False,https://www.tiktok.com/@khietnhinhi,Get Ready,7314039987904202753,https://www.tiktok.com/@khietnhinhi/video/7396980889080630536,36,283,19,21400,71,6,", APRILSKIN, APRILSKINPARTNER, kbeauty, aprilskin, beautytok, reviewlamdep, xuhuonglamdep, goclamdep, fyp, fyi, skincareroutine, ktrend",False,False,khietnhinhi,False,False,False,1,12,7,0,0,1,0,0,0,False
So sánh nền nắp tím mới 110-111-115 nè 🫶✨ #LearnOnTiktok #ReviewLamDep #reviewmypham #goclamdep #kemnenbatsang #lumimatte ,2024-07-28 13:54:45,28/07/2024,True,https://www.tiktok.com/@khietnhinhi,original sound - khietnhi,7396576586553723664,https://www.tiktok.com/@khietnhinhi/video/7396576563011063058,64,2013,215,140800,399,599,"learnontiktok, reviewlamdep, reviewmypham, goclamdep, kemnenbatsang, lumimatte",False,False,khietnhinhi,False,False,False,1,6,8,0,0,1,0,0,1,False
Chia sẻ lại về niềng răng và giữ trắng răng nhaaa #kemdanhrang #marvis #kemdanhrangcaocap #LearnOnTiktok #ReviewLamDep #reviewmypham #goclamdep ,2024-07-27 22:02:36,27/07/2024,True,https://www.tiktok.com/@khietnhinhi,original sound - khietnhi,7396331223483321105,https://www.tiktok.com/@khietnhinhi/video/7396331197808332040,80,202,3,13300,37,7,"kemdanhrang, marvis, kemdanhrangcaocap, learnontiktok, reviewlamdep, reviewmypham, goclamdep",False,False,khietnhinhi,False,False,False,0,7,11,0,0,0,0,1,1,False
Thêm 1 em tẩy trang ngon bổ rẻ cho mng tham khảo #freska #nuoctaytrang #LearnOnTiktok #ReviewLamDep #reviewmypham #goclamdep ,2024-07-27 14:19:44,27/07/2024,True,https://www.tiktok.com/@khietnhinhi,Daystar Hot Chocolate,6970867150491831042,https://www.tiktok.com/@khietnhinhi/video/7396211914432417031,49,797,28,90000,63,17,"freska, nuoctaytrang, learnontiktok, reviewlamdep, reviewmypham, goclamdep",False,False,khietnhinhi,False,False,False,0,6,12,0,0,1,0,0,1,False
Fomo nên ko thể bỏ qua kem nền carslan #LearnOnTiktok #ReviewLamDep #reviewmypham #goclamdep #carslan #kemnencarslan #kemnen ,2024-07-24 21:50:59,24/07/2024,True,https://www.tiktok.com/@khietnhinhi,original sound - khietnhi,7395215164377336593,https://www.tiktok.com/@khietnhinhi/video/7395214944461016338,50,447,51,93000,67,116,"learnontiktok, reviewlamdep, reviewmypham, goclamdep, carslan, kemnencarslan, kemnen",False,False,khietnhinhi,False,False,False,0,7,9,0,0,0,1,0,0,False
1 em son rất mướt mà có thể mí bà đã bỏ lỡ 🥹💕 #t#thefaceshopvietnamt#thefaceshopcleanbeautythefaceshop2024 #LearnOnTiktok #ReviewLamDep #reviewmypham #goclamdep ,2024-07-23 16:13:32,23/07/2024,False,https://www.tiktok.com/@khietnhinhi,daylight sped up,7270945328504474400,https://www.tiktok.com/@khietnhinhi/video/7394756890921684242,43,110,1,8887,5,1,"thefaceshopvietnam, thefaceshopcleanbeauty, learnontiktok, reviewlamdep, reviewmypham, goclamdep",False,False,khietnhinhi,False,False,False,1,7,13,0,0,1,0,0,0,False
Unboxing VT Cosmetics PR box with me @Picky Shop: @Picky Shop: #pickycreator #pickyplus #pickypartner Join as PickyPlus partner to receive these PR boxes with Kbeauty hotties every month. https://form.typeform.com/to/vGYiZ70A . Enter code NHIPLUS to sign up at Picky Creators 🩷 ,2024-07-23 08:26:06,23/07/2024,False,https://www.tiktok.com/@khietnhinhi,original sound - nuneworanuch,7002496080332000026,https://www.tiktok.com/@khietnhinhi/video/7394636423283985672,26,54,0,5386,3,2,", , pickycreator, pickyplus, pickypartner",False,False,khietnhinhi,False,False,False,1,3,36,0,1,0,0,0,0,False
Thơm quá đi ah Cocoon ơiiiiiiii #LearnOnTiktok #ReviewLamDep #reviewmypham #goclamdep #cocoonvietnam #scrubs #bodycare ,2024-07-22 21:26:19,22/07/2024,True,https://www.tiktok.com/@khietnhinhi,original sound - khietnhi,7394466529204931345,https://www.tiktok.com/@khietnhinhi/video/7394466413286558984,58,802,93,74600,87,39,"learnontiktok, reviewlamdep, reviewmypham, goclamdep, cocoonvietnam, scrubs, bodycare",False,False,khietnhinhi,False,False,False,0,7,6,0,0,0,1,0,0,False
1 em sáp tẩy trang dễ nhũ hoá ko lo bít tắc 🙏🏻 #LearnOnTiktok #ReviewLamDep #reviewmypham #goclamdep #medicube #medicubeambassador #kbeauty #cicabalm ,2024-07-22 15:15:45,22/07/2024,False,https://www.tiktok.com/@khietnhinhi,Pretty - Instrumental,6787498496824969218,https://www.tiktok.com/@khietnhinhi/video/7394370920049020168,41,369,9,21300,30,7,"learnontiktok, reviewlamdep, reviewmypham, goclamdep, medicube, medicubeambassador, kbeauty, cicabalm",False,False,khietnhinhi,False,False,False,1,8,12,0,0,1,0,0,0,False
Pov: let’s make fwee pudding pot a dewy blush 🍓🍇 ✨ #LearnOnTiktok #ReviewLamDep #reviewmypham #goclamdep #fwee #kbeauty #dewymakeup ,2024-07-21 20:03:44,21/07/2024,False,https://www.tiktok.com/@khietnhinhi,daylight sped up,7270945328504474400,https://www.tiktok.com/@khietnhinhi/video/7394074046901619986,34,487,12,17200,47,12,"learnontiktok, reviewlamdep, reviewmypham, goclamdep, fwee, kbeauty, dewymakeup",False,False,khietnhinhi,False,False,False,2,7,9,0,0,0,1,0,1,False
Bộ đôi serum Kerastase nên sở hữu nhất nha mấy bà @Kérastase #KerastaseVN  #LearnOnTiktok #ReviewLamDep #reviewmypham #goclamdep #haircare ,2024-07-20 14:30:01,20/07/2024,False,https://www.tiktok.com/@khietnhinhi,original sound - khietnhi,7393616984946051841,https://www.tiktok.com/@khietnhinhi/video/7393616966084218119,32,126,5,8342,10,5,", KerastaseVN, LearnOnTiktok, ReviewLamDep, reviewmypham, goclamdep, haircare",False,False,khietnhinhi,False,False,False,0,6,12,0,0,1,0,0,1,False
@Braye_Global lip sleek #LearnOnTiktok #ReviewLamDep #reviewmypham #goclamdep #swatches #brayelipsleek #braye ,2024-07-19 20:33:16,19/07/2024,False,https://www.tiktok.com/@khietnhinhi,MTG CHIHIRO by Mulú,7376375340984044294,https://www.tiktok.com/@khietnhinhi/video/7393339489118096647,32,361,37,23500,69,7,", LearnOnTiktok, ReviewLamDep, reviewmypham, goclamdep, swatches, brayelipsleek, braye",False,False,khietnhinhi,False,False,False,0,7,3,0,0,0,1,0,0,False
KCN nâng tone của Carslan mấy bà đã thử chưa #LearnOnTiktok #ReviewLamDep #reviewmypham #goclamdep #spf #carslan #toneup #sunscreen ,2024-07-19 13:16:12,19/07/2024,True,https://www.tiktok.com/@khietnhinhi,original sound - khietnhi,7393226885730110225,https://www.tiktok.com/@khietnhinhi/video/7393226854083120391,39,107,10,19000,12,16,"learnontiktok, reviewlamdep, reviewmypham, goclamdep, spf, carslan, toneup, sunscreen",False,False,khietnhinhi,False,False,False,0,8,10,0,0,1,0,0,0,False
@rhode skin this duo 🧸 #LearnOnTiktok #ReviewLamDep #reviewmypham #goclamdep #rhodeskin #blushes #liptint ,2024-07-18 21:31:57,18/07/2024,False,https://www.tiktok.com/@khietnhinhi,original sound - skingasm,7273786065651387137,https://www.tiktok.com/@khietnhinhi/video/7392983531737124104,20,5800,211,138000,641,42,", learnontiktok, reviewlamdep, reviewmypham, goclamdep, rhodeskin, blushes, liptint",False,False,khietnhinhi,False,False,False,1,7,4,0,0,0,1,0,0,False
@rhode skin #LearnOnTiktok #ReviewLamDep #reviewmypham #goclamdep #rhodeskin #rhode ,2024-07-18 11:59:05,18/07/2024,False,https://www.tiktok.com/@khietnhinhi,watashi wa star,7387262819786787600,https://www.tiktok.com/@khietnhinhi/video/7392835897793727751,0,221,5,11300,28,7,", LearnOnTiktok, ReviewLamDep, reviewmypham, goclamdep, rhodeskin, rhode",True,False,khietnhinhi,False,False,False,0,6,2,0,1,0,0,0,0,False
Which Beauty of Joseon SPF you prefer? @Beauty of Joseon @BAZZAAL #beautyofjoseonsunscreen #beautyofjoseon #viralsunscreen #sunscreen #sunstick #spf #koreansunscreen #koreanspf ,2024-07-17 14:42:27,17/07/2024,False,https://www.tiktok.com/@khietnhinhi,Some,7150634541730859802,https://www.tiktok.com/@khietnhinhi/video/7392506916037070087,26,159,15,10400,27,8,", , beautyofjoseonsunscreen, beautyofjoseon, viralsunscreen, sunscreen, sunstick, spf, koreansunscreen, koreanspf",False,False,khietnhinhi,False,False,False,0,8,11,0,0,1,0,0,0,False
Review cushion mới của BBIA 🫶🎀 #LearnOnTiktok #ReviewLamDep #reviewmypham #goclamdep #eauglowcushion #mongnhe #benmau24h #bbia #skyinfluencer ,2024-07-16 23:32:46,16/07/2024,False,https://www.tiktok.com/@khietnhinhi,smoooth operatorrrr,7220122624674859822,https://www.tiktok.com/@khietnhinhi/video/7392272487783976200,39,85,4,7188,5,1,"learnontiktok, reviewlamdep, reviewmypham, goclamdep, eauglowcushion, mongnhe, benmau24h, bbia, skyinfluencer",False,False,khietnhinhi,False,False,False,1,9,5,0,0,0,0,1,0,False
1 dịch vụ mà tui nghĩ mọi người cần nèeeee @Dermalogica Vietnam #LearnOnTiktok #ReviewLamDep #reviewmypham #goclamdep #dermalogica #dermaplaning ,2024-07-15 20:22:54,15/07/2024,False,https://www.tiktok.com/@khietnhinhi,original sound - khietnhi,7391852509394291472,https://www.tiktok.com/@khietnhinhi/video/7391852476653210887,71,455,17,17100,76,9,", learnontiktok, reviewlamdep, reviewmypham, goclamdep, dermalogica, dermaplaning",False,False,khietnhinhi,False,False,False,0,6,12,0,0,0,1,0,0,False
KCN nâng tone căng bóng nhưng vẫn ráo mịn đó mấy bà #LearnOnTiktok #ReviewLamDep #reviewmypham #goclamdep #kbeauty #Espoir #EspoirVN #CicaToneup ,2024-07-15 12:09:21,15/07/2024,False,https://www.tiktok.com/@khietnhinhi,original sound - khietnhi,7391725333956856593,https://www.tiktok.com/@khietnhinhi/video/7391725287144164616,53,1344,98,112500,234,52,"learnontiktok, reviewlamdep, reviewmypham, goclamdep, kbeauty, espoir, espoirvn, cicatoneup",False,False,khietnhinhi,False,False,False,0,8,12,0,0,1,0,0,0,False
Pov: makep chỉ với 2 món của fwee #LearnOnTiktok #ReviewLamDep #reviewmypham #goclamdep #kbeauty #kbeautymakeup #fwee #cushion #makeuptutorial ,2024-07-14 21:58:10,14/07/2024,False,https://www.tiktok.com/@khietnhinhi,xoxo gossip girl,6988639249868278533,https://www.tiktok.com/@khietnhinhi/video/7391505940991855880,29,255,8,13500,38,10,"learnontiktok, reviewlamdep, reviewmypham, goclamdep, kbeauty, kbeautymakeup, fwee, cushion, makeuptutorial",False,False,khietnhinhi,False,False,False,0,9,8,0,0,0,1,0,1,False
Tín đồ của dòng DACTO nhà @One-day's you Vietnam đâu rùiiiiii #onedaysyou #onedaysyouvietnam #dactopad #dactotoner #onedaysyoudactochallenge #LearnOnTiktok #ReviewLamDep #reviewmypham #goclamdep ,2024-07-13 22:01:31,13/07/2024,False,https://www.tiktok.com/@khietnhinhi,Cute,7136445672676411393,https://www.tiktok.com/@khietnhinhi/video/7391135717587471623,54,72,3,5553,9,1,", onedaysyou, onedaysyouvietnam, dactopad, dactotoner, onedaysyoudactochallenge, learnontiktok, reviewlamdep, reviewmypham, goclamdep",False,False,khietnhinhi,False,False,False,0,9,11,0,0,0,0,1,1,False
@rhode skin pocket blushes - all shades swatches 🎀🧸🐻 #LearnOnTiktok #rhode #rhodeskin #pocketblush #ReviewLamDep #reviewmypham #blushes #swatches #goclamdep ,2024-07-13 15:32:55,13/07/2024,False,https://www.tiktok.com/@khietnhinhi,spin u round,7323438291918817281,https://www.tiktok.com/@khietnhinhi/video/7391035580705950984,37,10200,1543,473900,2876,214,", learnontiktok, rhode, rhodeskin, pocketblush, reviewlamdep, reviewmypham, blushes, swatches, goclamdep",False,False,khietnhinhi,False,False,False,1,9,8,0,0,1,0,0,1,False
Swatches in a hurry but these pocket babies are sooooo nice nice nice @rhode skin #LearnOnTiktok #rhode #rhodeskin #pocketblush #ReviewLamDep #reviewmypham #swatches #blushes ,2024-07-12 16:46:18,12/07/2024,False,https://www.tiktok.com/@khietnhinhi,origineel geluid,7273537731446590240,https://www.tiktok.com/@khietnhinhi/video/7390683408478801159,29,2605,231,113000,438,93,", learnontiktok, rhode, rhodeskin, pocketblush, reviewlamdep, reviewmypham, swatches, blushes",False,False,khietnhinhi,False,False,False,0,8,15,0,0,1,0,0,0,False
GRW-MAC #MACCOSMETICSVN #IWEARMAC #LearnOnTiktok #ReviewLamDep #reviewmypham #goclamdep #macfixplus ,2024-07-12 14:15:33,12/07/2024,False,https://www.tiktok.com/@khietnhinhi,Sh-Boom,6735289256408795138,https://www.tiktok.com/@khietnhinhi/video/7390644557576195336,40,132,2,8150,19,5,"maccosmeticsvn, iwearmac, learnontiktok, reviewlamdep, reviewmypham, goclamdep, macfixplus",False,False,khietnhinhi,False,False,False,0,7,1,0,0,1,0,0,0,False
Câu hỏi mà t nhận được nhiều nhất luônnnnn @ALICE BEU_Filler Môi Tự Nhiên #LearnOnTiktok #ReviewLamDep #reviewmypham #goclamdep #sharing ,2024-07-11 20:42:37,11/07/2024,False,https://www.tiktok.com/@khietnhinhi,original sound - khietnhi,7390373249516948225,https://www.tiktok.com/@khietnhinhi/video/7390373225118633224,39,4028,379,129800,1600,62,", learnontiktok, reviewlamdep, reviewmypham, goclamdep, sharing",False,False,khietnhinhi,False,False,False,0,5,14,0,0,0,1,0,0,False
"Tham gia và cảm nhận cùng Nhi nhé cả nhà
#ShiseidoVN #3NgayRangRo #BelieveinBeauty #LearnOnTiktok #ReviewLamDep #reviewmypham #goclamdep @SHISEIDO Việt Nam ",2024-07-11 09:39:51,11/07/2024,False,https://www.tiktok.com/@khietnhinhi,original sound - khietnhi,7390202453427292929,https://www.tiktok.com/@khietnhinhi/video/7390202419029855506,60,302,1,17700,1,5,"shiseidovn, 3ngayrangro, believeinbeauty, learnontiktok, reviewlamdep, reviewmypham, goclamdep, ",False,False,khietnhinhi,False,False,False,0,7,13,0,1,0,0,0,0,False
Make fwee keychain with me #LearnOnTiktok #ReviewLamDep #reviewmypham #goclamdep #fwee #keychain #thuvienmakeup ,2024-07-10 21:02:08,10/07/2024,False,https://www.tiktok.com/@khietnhinhi,atyourbest,7107704945235020587,https://www.tiktok.com/@khietnhinhi/video/7390007164972043538,23,765,28,30800,81,11,"learnontiktok, reviewlamdep, reviewmypham, goclamdep, fwee, keychain, thuvienmakeup",False,False,khietnhinhi,False,False,False,0,7,5,0,0,0,1,0,0,False
Tutorial makeup đơn giản của tôi nhưng voiceover là 1 câu chuyện hoàn toàn khác 😂 #LearnOnTiktok #ReviewLamDep #reviewmypham #goclamdep #lumimatte #kemnenbatsang #thuvienmakeup ,2024-07-10 17:39:15,10/07/2024,False,https://www.tiktok.com/@khietnhinhi,original sound - khietnhi,7389954905181604625,https://www.tiktok.com/@khietnhinhi/video/7389954878380068103,66,3298,48,60600,489,76,"learnontiktok, reviewlamdep, reviewmypham, goclamdep, lumimatte, kemnenbatsang, thuvienmakeup",False,False,khietnhinhi,False,False,False,1,7,15,0,0,1,0,0,0,False
Summer summer with dasique @Dasique Global @dasique #LearnOnTiktok #ReviewLamDep #reviewmypham #goclamdep #dasique ,2024-07-09 19:27:27,09/07/2024,False,https://www.tiktok.com/@khietnhinhi,original sound,7236085426519001883,https://www.tiktok.com/@khietnhinhi/video/7389611680239488274,26,110,0,6057,13,1,", , learnontiktok, reviewlamdep, reviewmypham, goclamdep, dasique",False,False,khietnhinhi,False,False,True,0,5,7,0,0,0,1,0,0,False
Mê dữ rồi đó hổm giờ gặp ko ai hỏi cũng kêu em dg xài nên mới maybelline nè đẹp lắm :))))) #LearnOnTiktok #ReviewLamDep #reviewmypham #goclamdep #lumimatte #kemnenbatsang #maybelline ,2024-07-09 13:58:17,09/07/2024,False,https://www.tiktok.com/@khietnhinhi,original sound - khietnhi,7389526875925662481,https://www.tiktok.com/@khietnhinhi/video/7389526848679595271,17,259,8,10200,18,11,"learnontiktok, reviewlamdep, reviewmypham, goclamdep, lumimatte, kemnenbatsang, maybelline",False,False,khietnhinhi,False,False,False,0,7,22,0,0,1,0,0,0,False
#belifgiftedme #gifted_by_LGbeauty @belif @sephora don’t forget your eyes 🙌🏻 #goclamdep #LearnOnTiktok #ReviewLamDep #reviewmypham #belif  ,2024-07-09 11:56:11,09/07/2024,False,https://www.tiktok.com/@khietnhinhi,original sound - skingasm,7273786065651387137,https://www.tiktok.com/@khietnhinhi/video/7389495375435975954,19,84,7,7439,11,9,"belifgiftedme, gifted_by_lgbeauty, , , goclamdep, learnontiktok, reviewlamdep, reviewmypham, belif",False,False,khietnhinhi,False,False,False,1,7,6,0,1,0,0,0,0,False
Swatch son mới nhà Sugarplum MistyNow Blurring Tint @sugarplum.vn #goclamdep #LearnOnTiktok #ReviewLamDep #reviewmypham #ofelia #swatches #swatchson ,2024-07-08 20:55:57,08/07/2024,True,https://www.tiktok.com/@khietnhinhi,Cute,7136445672676411393,https://www.tiktok.com/@khietnhinhi/video/7389263398883593480,69,7130,709,1700000,1364,280,", goclamdep, learnontiktok, reviewlamdep, reviewmypham, ofelia, swatches, swatchson",False,False,khietnhinhi,False,False,False,0,7,9,0,0,0,1,0,0,False
Dòng làm sạch Lacto Soy mới của nhà somebymi ạ @somebymi.official #goclamdep #LearnOnTiktok #ReviewLamDep #somebymi ,2024-07-08 13:28:55,08/07/2024,True,https://www.tiktok.com/@khietnhinhi,original sound - khietnhi,7389148238168738576,https://www.tiktok.com/@khietnhinhi/video/7389148197018438919,40,425,13,654600,52,10,", goclamdep, learnontiktok, reviewlamdep, somebymi",False,False,khietnhinhi,False,False,False,0,4,11,0,0,1,0,0,0,False
Test OHUI Jean Cushion mới nhaaaaa #goclamdep #LearnOnTiktok #ReviewLamDep #ohuivietnam #jeancushion #cushionkiemdau @OHUI ,2024-07-06 21:03:55,06/07/2024,False,https://www.tiktok.com/@khietnhinhi,original sound - khietnhi,7388523567481817872,https://www.tiktok.com/@khietnhinhi/video/7388523276789665032,87,599,74,62600,140,18,"goclamdep, learnontiktok, reviewlamdep, ohuivietnam, jeancushion, cushionkiemdau, ",False,False,khietnhinhi,False,False,False,0,6,7,0,0,0,1,0,1,False
New shade #122 added to my YSL Loveshine @YSL Beauty Vietnam @YSL Beauty collection 🤤💖🫶 #goclamdep #LearnOnTiktok #ReviewLamDep #yslbeauty #yslbeautyvn #yslloveshine #loveshine #lipoil ,2024-07-06 17:06:04,06/07/2024,True,https://www.tiktok.com/@khietnhinhi,Closer (feat. H.E.R.),7060685419460954113,https://www.tiktok.com/@khietnhinhi/video/7388461981365177608,26,12800,854,5300000,2549,82,"122, , , goclamdep, LearnOnTiktok, ReviewLamDep, yslbeauty, yslbeautyvn, yslloveshine, loveshine, lipoil",False,False,khietnhinhi,False,False,False,1,9,13,0,0,1,0,0,1,False
Ước gì có hết 30 màu 🤧💖 #goclamdep #LearnOnTiktok #ReviewLamDep #fwee #swatches ft. FWEE PUDDING POT ,2024-07-05 20:54:35,05/07/2024,False,https://www.tiktok.com/@khietnhinhi,origineel geluid,7273537731446590240,https://www.tiktok.com/@khietnhinhi/video/7388149790187474184,33,880,65,48700,178,24,"goclamdep, learnontiktok, reviewlamdep, fwee, swatches",False,False,khietnhinhi,False,False,False,1,5,10,0,0,0,1,0,0,False
Combo yêu thích của tôi dạo này 💖💖💖 @ofeliavietnam x @sugarplum.vn #goclamdep #LearnOnTiktok #ReviewLamDep #ofelia #sugarplum #nomakeupmakeup #dailyroutine ,2024-07-05 13:33:14,05/07/2024,True,https://www.tiktok.com/@khietnhinhi,On Wednesday we wear pink karen,7114698495592368923,https://www.tiktok.com/@khietnhinhi/video/7388036050091822354,14,27100,1122,7500000,4404,239,", , goclamdep, learnontiktok, reviewlamdep, ofelia, sugarplum, nomakeupmakeup, dailyroutine",False,False,khietnhinhi,False,False,False,1,7,10,0,0,1,0,0,0,False
Vũ khí mùa hè LRP Anthelios UVMUNE400 #goclamdep #LearnOnTiktok #ReviewLamDep #LaRochePosayVN #LaRochePosay #AntheliosUVMune400 #Mexoryl400 #chongnang400 ,2024-07-04 22:06:35,04/07/2024,False,https://www.tiktok.com/@khietnhinhi,original sound - khietnhi,7387802442311813905,https://www.tiktok.com/@khietnhinhi/video/7387797263034240263,42,10200,139,296100,11,6,"goclamdep, learnontiktok, reviewlamdep, larocheposayvn, larocheposay, antheliosuvmune400, mexoryl400, chongnang400",False,False,khietnhinhi,False,False,True,0,8,7,0,0,0,0,1,0,False
I fell in love with this petal @Westman-Atelier #goclamdep #LearnOnTiktok #ReviewLamDep #blush #westmanatelier ,2024-07-04 16:16:39,04/07/2024,False,https://www.tiktok.com/@khietnhinhi,nhạc nền - J-music,6955870899220351746,https://www.tiktok.com/@khietnhinhi/video/7387707082834971922,20,1771,96,103400,355,42,", goclamdep, learnontiktok, reviewlamdep, blush, westmanatelier",False,False,khietnhinhi,False,False,False,0,5,8,0,0,1,0,0,0,False
Enjoy a home spa day with this ice jelly mask @Mediheal Us @BAZZAAL #goclamdep #LearnOnTiktok #ReviewLamDep #mediheal #cooldownglowup #icyjellymask #diyhomespa #kmodelingmask #koreanfacemask ,2024-07-04 09:28:08,04/07/2024,False,https://www.tiktok.com/@khietnhinhi,Daystar Hot Chocolate,6970867150491831042,https://www.tiktok.com/@khietnhinhi/video/7387601805569559815,21,222,9,11400,16,11,", , goclamdep, learnontiktok, reviewlamdep, mediheal, cooldownglowup, icyjellymask, diyhomespa, kmodelingmask, koreanfacemask",False,False,khietnhinhi,False,False,False,0,9,13,0,1,0,0,0,0,False
Bộ đôi lót trc lớp nền mà tui rất là thíchhhhhhh #goclamdep #LearnOnTiktok #ReviewLamDep #serum #9wishes ,2024-07-03 21:16:37,03/07/2024,True,https://www.tiktok.com/@khietnhinhi,Cute,7136445672676411393,https://www.tiktok.com/@khietnhinhi/video/7387413294354681095,54,52,11,6811,9,5,"goclamdep, learnontiktok, reviewlamdep, serum, 9wishes",False,False,khietnhinhi,False,False,False,0,5,11,0,0,0,1,0,0,False
This palette is all I need 😭😭😭 #goclamdep #LearnOnTiktok #ReviewLamDep #diorbeauty #diormakeup #highlighter ,2024-07-03 12:19:04,03/07/2024,False,https://www.tiktok.com/@khietnhinhi,original sound - elly belly,7052671691298130690,https://www.tiktok.com/@khietnhinhi/video/7387274772788284679,20,5684,348,206500,824,82,"goclamdep, learnontiktok, reviewlamdep, diorbeauty, diormakeup, highlighter",False,False,khietnhinhi,False,False,False,1,6,6,0,0,1,0,0,0,False
#belifgiftedme @belif @sephora #gifted_by_LGbeauty New True Cream Aqua Bomb Sunscreen #skincare #spf #belif @Belif VN ,2024-07-03 07:32:04,03/07/2024,False,https://www.tiktok.com/@khietnhinhi,Moonlight romance,6970258144526191361,https://www.tiktok.com/@khietnhinhi/video/7387200806849645842,29,82,1,7817,18,8,"belifgiftedme, , , gifted_by_LGbeauty, skincare, spf, belif, ",False,False,khietnhinhi,False,False,False,0,5,10,0,1,0,0,0,0,False
1 trong những em serum HA cấp ẩm sâu mà tui test dạo gần đâyyy #goclamdep #LearnOnTiktok #ReviewLamDep #skincare #skincareroutine #hydratedskin #thelabvn #thelabbyblancdoux #thelabsun ,2024-07-02 21:09:12,02/07/2024,True,https://www.tiktok.com/@khietnhinhi,original sound - khietnhi,7387045484369906448,https://www.tiktok.com/@khietnhinhi/video/7387040303166934280,50,176,6,172200,21,4,"goclamdep, learnontiktok, reviewlamdep, skincare, skincareroutine, hydratedskin, thelabvn, thelabbyblancdoux, thelabsun",False,False,khietnhinhi,False,False,False,0,9,15,0,0,0,1,0,0,False
Retinol mắc nhất mà mình từng dùng #goclamdep #LearnOnTiktok #ReviewLamDep #skincare #skincareroutine #retinol ,2024-07-01 21:20:12,01/07/2024,True,https://www.tiktok.com/@khietnhinhi,original sound - khietnhi,7386672484633856769,https://www.tiktok.com/@khietnhinhi/video/7386672051165072658,101,897,109,160700,269,125,"goclamdep, learnontiktok, reviewlamdep, skincare, skincareroutine, retinol",False,False,khietnhinhi,False,False,False,0,6,7,0,0,0,1,0,0,False
Và tui lại là người fomo em nền nắp tím của maybelline đây #goclamdep #LearnOnTiktok #ReviewLamDep #kemnenbatsang #lumimatte #thuvienmakeup ,2024-07-01 12:12:35,01/07/2024,False,https://www.tiktok.com/@khietnhinhi,Cute,7136445672676411393,https://www.tiktok.com/@khietnhinhi/video/7386530924688690440,87,143,16,11100,22,21,"goclamdep, learnontiktok, reviewlamdep, kemnenbatsang, lumimatte, thuvienmakeup",False,False,khietnhinhi,False,False,True,0,6,13,0,0,1,0,0,0,False
review FWEE cushion glass natural 🌸💖✨ #goclamdep #LearnOnTiktok #ReviewLamDep #fwee #cushion #glassskin #naturalmakeup ,2024-06-30 20:10:32,30/06/2024,False,https://www.tiktok.com/@khietnhinhi,original sound - khietnhi,7386288202682354449,https://www.tiktok.com/@khietnhinhi/video/7386283019809606919,64,1203,143,102400,216,189,"goclamdep, learnontiktok, reviewlamdep, fwee, cushion, glassskin, naturalmakeup",False,False,khietnhinhi,False,False,False,1,7,5,0,0,0,1,0,1,False
