text,createTime,createTimeISO,isAd,profileUrl,musicName,musicId,webVideoUrl,duration,diggCount,shareCount,playCount,collectCount,commentCount,hashtags,isSlideshow,isSponsored,kol_username,ttSeller,commerceUser,is_trending,emoji_count,hashtag_count,word_count_no_emoji_hashtag,early_morning,morning,afternoon,evening,late_night,is_weekend,is_pinned
Nên thủ sẵn 1 chai nheeeee @One-day's you Vietnam #onedaysyou #onedaysyouvietnam #goclamdep #beautytok #learnontiktok #reviewlamdep #skincare #skincareroutine #kbeauty #beautytips ,2024-04-26 12:08:19,26/04/2024,False,https://www.tiktok.com/@khietnhinhi,GRWM / Routine / Cooking / TikTok(1245023),7099212783622817794,https://www.tiktok.com/@khietnhinhi/video/7362038189197888786,50,115,5,6654,21,3,", onedaysyou, onedaysyouvietnam, goclamdep, beautytok, learnontiktok, reviewlamdep, skincare, skincareroutine, kbeauty, beautytips",False,False,khietnhinhi,False,False,False,0,10,9,0,0,1,0,0,0,False
"Lần đầu dùng tinh chất nhân sâm lên da, cùng tui xem kết quả sau 7 ngày nha @Sulwhasoo Vietnam #goclamdep #beautytok #learnontiktok #reviewlamdep #skincare #skincareroutine #chonglaohoa #SulwhasooVN #7NgayNhuanSac
#CapCut ",2024-04-25 20:38:29,25/04/2024,True,https://www.tiktok.com/@khietnhinhi,original sound - khietnhi,7361798916960242448,https://www.tiktok.com/@khietnhinhi/video/7361798591754603794,52,330,28,40500,40,15,", goclamdep, beautytok, learnontiktok, reviewlamdep, skincare, skincareroutine, chonglaohoa, sulwhasoovn, 7ngaynhuansac, capcut",False,False,khietnhinhi,False,False,False,0,10,20,0,0,0,1,0,0,False
1 chút tips nho nhỏ chia sẻ để mình cùng nhau ko bị hói 😆🫶✨ #goclamdep #beautytok #learnontiktok #reviewlamdep #haircare #haircareroutine #hairloss #share #hairtips #cocoonvietnam ,2024-04-24 21:05:12,24/04/2024,True,https://www.tiktok.com/@khietnhinhi,Routine Vlog Day,7260632355633907714,https://www.tiktok.com/@khietnhinhi/video/7361434383703706888,67,4815,148,190600,1004,38,"goclamdep, beautytok, learnontiktok, reviewlamdep, haircare, haircareroutine, hairloss, share, hairtips, cocoonvietnam",False,False,khietnhinhi,False,False,False,1,10,14,0,0,0,1,0,0,False
Review nhanh các em toner pad của nhà  @One-day's you Vietnam @onedaysyou_global #goclamdep #beautytok #learnontiktok #beauty #reviewlamdep #skincare #skincareroutine #tonerpad #kbeauty #koreanskincare ,2024-04-23 12:30:38,23/04/2024,False,https://www.tiktok.com/@khietnhinhi,Cute,7246641499344734210,https://www.tiktok.com/@khietnhinhi/video/7360930694677286152,137,4296,204,90200,637,293,", , goclamdep, beautytok, learnontiktok, beauty, reviewlamdep, skincare, skincareroutine, tonerpad, kbeauty, koreanskincare",False,False,khietnhinhi,False,False,False,0,10,12,0,0,1,0,0,0,False
"Estee Lauder 2 simple steps to a flawless no-filter base 🫶✨ I’m obsessed! #MyShadeMyStory #DoubleWear #GiftedByEstee #communityxseen #myshadestory @Estée Lauder @Community X SEEN 
#goclamdep #beautytok #learnontiktok #beauty #reviewlamdep #makeup #flawlessmakeup ",2024-04-22 12:42:55,22/04/2024,False,https://www.tiktok.com/@khietnhinhi,Aesthetic Coffee,7285267372923193345,https://www.tiktok.com/@khietnhinhi/video/7360562770611391762,32,215,29,21700,64,23,"myshademystory, doublewear, giftedbyestee, communityxseen, myshadestory, , , goclamdep, beautytok, learnontiktok, beauty, reviewlamdep, makeup, flawlessmakeup",False,False,khietnhinhi,False,False,False,1,12,17,0,0,1,0,0,0,False
Đừng chử tui nge 🤡😂 #goclamdep #beautytok #learnontiktok #beauty #kemnen #reviewlamdep #makeup #trangdiem #esteelauder #foundation #primer ,2024-04-21 23:16:45,21/04/2024,False,https://www.tiktok.com/@khietnhinhi,original sound - khietnhi,7360355078445763345,https://www.tiktok.com/@khietnhinhi/video/7360355032132357394,57,2856,120,180300,688,247,"goclamdep, beautytok, learnontiktok, beauty, kemnen, reviewlamdep, makeup, trangdiem, esteelauder, foundation, primer",False,False,khietnhinhi,False,False,False,1,11,4,0,0,0,0,1,1,False
Chill chill ngày chủ nhật với @Merzy Vietnam Siren melting balm 🧜‍♀️💜#goclamdep #beautytok #learnontiktok #beauty #reviewlamdep #swatchson #swatches #lipbalm #glossylips ,2024-04-21 11:26:29,21/04/2024,True,https://www.tiktok.com/@khietnhinhi,Bluebird,7227802327897786369,https://www.tiktok.com/@khietnhinhi/video/7360171987995577618,25,765,119,77100,157,30,", goclamdep, beautytok, learnontiktok, beauty, reviewlamdep, swatchson, swatches, lipbalm, glossylips",False,False,khietnhinhi,False,False,False,3,9,12,0,1,0,0,0,1,False
Peripera gloss 03 & 06 #fyp #goclamdep #beautytok #learnontiktok #beauty #reviewlamdep #swatches #swatchson #glossylips ,2024-04-20 19:59:27,20/04/2024,False,https://www.tiktok.com/@khietnhinhi,shut up my moms calling x,7219727959609936645,https://www.tiktok.com/@khietnhinhi/video/7359933102518537480,36,8392,284,194900,826,149,"fyp, goclamdep, beautytok, learnontiktok, beauty, reviewlamdep, swatches, swatchson, glossylips",False,False,khietnhinhi,False,False,False,0,9,5,0,0,0,1,0,1,False
"Mụn ẩn & bít tắc lỗ chân lông, nền da sần sùi hãy thử add 1 trong 3 em này vô routine nha mí bà 🫶 #fyp #goclamdep #beautytok #skincare #skincareroutine #duongda #bha #peel #dermalogica #biologiquerecherche #learnontiktok #routineskincare ",2024-04-20 11:33:42,20/04/2024,False,https://www.tiktok.com/@khietnhinhi,"Elegant and lively violin jazz - Cuisine, food, gourmet, cafe(1310636)",7146288773452531713,https://www.tiktok.com/@khietnhinhi/video/7359802767449410824,77,966,24,48500,499,44,"fyp, goclamdep, beautytok, skincare, skincareroutine, duongda, bha, peel, dermalogica, biologiquerecherche, learnontiktok, routineskincare",False,False,khietnhinhi,False,False,True,1,12,25,0,1,0,0,0,1,False
Mỗi lần quay đọc tên brand này là hơi líu lưỡi nên lúc nào cũng phải làm lại 2 3 lần :))) anw rì viu nhẹ cho mí bà phấn phủ của nhà TCFS nhá #toocoolforschool #fyp #goclamdep #beautytok #beauty #reviewlamdep #makeup #trangdiem #settingpowder ,2024-04-19 20:15:18,19/04/2024,False,https://www.tiktok.com/@khietnhinhi,show me how,7118185058074397483,https://www.tiktok.com/@khietnhinhi/video/7359566091816946952,90,493,27,27400,47,9,"toocoolforschool, fyp, goclamdep, beautytok, beauty, reviewlamdep, makeup, trangdiem, settingpowder",False,False,khietnhinhi,False,False,False,0,9,35,0,0,0,1,0,0,False
"Cảm ơn ANESSA Vietnam đã tạo cơ hội cho Nhi tham gia sự kiên ra mắt dòng chống nắng phiên bản mới 2024.
Ngoài việc thay đổi bao bì sản phẩm từ nhựa sang bao bì giấy vì bảo vệ môi trường,
Phiên bản chống nắng mới của Anessa với công nghệ AutoVeil mang lại hiệu quả giúp ngăn ngừa nguy cơ đứt gãy màng lọc UV; đồng thời củng cố khả năng chống nắng tự nhiên của da.

Ngoài ra tại sự kiện, mình còn có cơ hội được trải nghiệm siêu phẩm Serum dưỡng nhả nắng - Night Sun Care Serum nữa. Mong chờ ngày ẻm được bán chính thức quá đi 💙

Cảm ơn @Anessa Official Store #anessa #AUTOVEIL #goclamdep #beauty #beautytok #learnontiktok 
#CapCut ",2024-04-18 16:04:56,18/04/2024,False,https://www.tiktok.com/@khietnhinhi,"Elegant and lively violin jazz - Cuisine, food, gourmet, cafe(1310636)",7146288773452531713,https://www.tiktok.com/@khietnhinhi/video/7359130499362655495,28,290,6,8889,18,27,", anessa, autoveil, goclamdep, beauty, beautytok, learnontiktok, capcut",False,False,khietnhinhi,False,False,True,1,7,119,0,0,1,0,0,0,False
Có nên mua / sử dụng HIGHLIGHT BALM/GLOW STICK hay không ??? #fyp #goclamdep #reviewlamdep #glowyskin #hince #chanelbeauty #highlighter #glowskin #makeup #beauty ,2024-04-17 11:35:53,17/04/2024,False,https://www.tiktok.com/@khietnhinhi,Storytelling,7031101555747080194,https://www.tiktok.com/@khietnhinhi/video/7358690072591404295,72,786,15,40200,91,30,"fyp, goclamdep, reviewlamdep, glowyskin, hince, chanelbeauty, highlighter, glowskin, makeup, beauty",False,False,khietnhinhi,False,False,False,0,10,12,0,1,0,0,0,0,False
"Mixsoon viral Bean Essence 🙌🏻✨ #fyp #goclamdep #reviewlamdep #beanessence, #vegansnail, #snailmucin, #happysnail, #glassskin, #texturedskin
#koreano1essence #mixsoonbeanessence, #cleanbeauty, #veganbeauty, #koreanskincare #glowyskin,
#skincareroutine, #kbeauty, #skincare ",2024-04-16 12:41:22,16/04/2024,False,https://www.tiktok.com/@khietnhinhi,MOKKOJI Kitchen,7026962941702309889,https://www.tiktok.com/@khietnhinhi/video/7358335875740208392,34,79,0,4223,9,3,"fyp, goclamdep, reviewlamdep, beanessence, vegansnail, snailmucin, happysnail, glassskin, texturedskin, koreano1essence, mixsoonbeanessence, cleanbeauty, veganbeauty, koreanskincare, glowyskin, skincareroutine, kbeauty, skincare",False,False,khietnhinhi,False,False,False,1,18,15,0,0,1,0,0,0,False
"Woaaaaaa trên tay BST M.O.I The New Iconic mới 💙💙💙 #goclamdep #reviewlamdep #fyp #moicosmetics #TheNewIconic #sonjeans #lamdep #makeup #beauty
#lipstick #sonmoi #swatchson #makeup #trangdiem #beautyreview #beautytips",2024-04-15 21:12:46,15/04/2024,False,https://www.tiktok.com/@khietnhinhi,original sound - khietnhi,7358101756791884545,https://www.tiktok.com/@khietnhinhi/video/7358096570002328840,60,233,29,23100,31,7,"goclamdep, reviewlamdep, fyp, moicosmetics, thenewiconic, sonjeans, lamdep, makeup, beauty, lipstick, sonmoi, swatchson, makeup, trangdiem, beautyreview, beautytips",False,False,khietnhinhi,False,False,False,1,16,9,0,0,0,1,0,0,False
Son MAC ko khô môi? 🙌🏻 THE NEW MACximal ✨ #goclamdep #reviewlamdep #mypham #sonli #fyp #swatches #MACCOSMETICSVN #IWEARMAC #MACXIMAL #swatchson ,2024-04-14 20:31:10,14/04/2024,False,https://www.tiktok.com/@khietnhinhi,i like the way you kiss me,7347941873543890946,https://www.tiktok.com/@khietnhinhi/video/7357714769924640018,32,448,101,104000,125,62,"goclamdep, reviewlamdep, mypham, sonli, fyp, swatches, maccosmeticsvn, iwearmac, macximal, swatchson",False,False,khietnhinhi,False,False,False,2,10,8,0,0,0,1,0,1,False
Tầm quan trọng của việc double cleansing trong công cuộc tạm bịt mụn ẩn của tui #taytrangsenka #sachsaulanhtinh #goclamdep #reviewlamdep #reviewmypham #chamsocda #taytrang #skincare #fyp ,2024-04-13 21:48:41,13/04/2024,False,https://www.tiktok.com/@khietnhinhi,Chill Vibes,7323194262220621825,https://www.tiktok.com/@khietnhinhi/video/7357363663356874002,78,594,1,63000,6,3,"taytrangsenka, sachsaulanhtinh, goclamdep, reviewlamdep, reviewmypham, chamsocda, taytrang, skincare, fyp",False,False,khietnhinhi,False,False,False,0,9,16,0,0,0,1,0,1,False
Chai cocoon cuối cùng trong tủ…. #goclamdep #reviewlamdep #reviewmypham #chamsocda #taytrang #skincare #cocoonvietnam #fyp ,2024-04-12 20:34:49,12/04/2024,True,https://www.tiktok.com/@khietnhinhi,That Couch Potato Again,7239756792690296833,https://www.tiktok.com/@khietnhinhi/video/7356973544892353810,39,265,4,74600,15,17,"goclamdep, reviewlamdep, reviewmypham, chamsocda, taytrang, skincare, cocoonvietnam, fyp",False,False,khietnhinhi,False,False,False,0,8,6,0,0,0,1,0,0,False
Peel da tại nhà với obagi blue peel lần 2 😆 #goclamdep #reviewlamdep #reviewmypham #chamsocda #peeling #peelda #peeldatainha #skincare #skincareroutine #xuhuong #viral ,2024-04-11 22:10:14,11/04/2024,False,https://www.tiktok.com/@khietnhinhi,original sound - khietnhi,7356627106438318864,https://www.tiktok.com/@khietnhinhi/video/7356627046711184648,78,311,22,24100,59,16,"goclamdep, reviewlamdep, reviewmypham, chamsocda, peeling, peelda, peeldatainha, skincare, skincareroutine, xuhuong, viral",False,False,khietnhinhi,False,False,False,1,11,10,0,0,0,0,1,0,False
Test vội test liền romand bst mới Spring Ever 2024 mấy bà oiiiii @롬앤 #CapCut #romand #gloss #liptint #swatches #swatchson #goclamdep #reviewlamdep #makeup ,2024-04-10 21:06:13,10/04/2024,True,https://www.tiktok.com/@khietnhinhi,Chill Vibes,7323194262220621825,https://www.tiktok.com/@khietnhinhi/video/7356239451921730823,67,6407,273,127400,917,74,", CapCut, romand, gloss, liptint, swatches, swatchson, goclamdep, reviewlamdep, makeup",False,False,khietnhinhi,False,False,True,0,9,14,0,0,0,1,0,0,False
Vậy cho mấy bà dễ coi màu nè :)) 🙏🏻 my forever love 🤣 @Hourglass Cosmetics phantom volumizing glossy balm collection swatches #fyp #goclamdep #reviewlamdep #reviewmypham #swatches #swatchson #makeup #lipgloss #hourglass #hourglasscosmetics #xuhuong #viral ,2024-04-10 11:58:41,10/04/2024,False,https://www.tiktok.com/@khietnhinhi,supernatural,7343862682463816481,https://www.tiktok.com/@khietnhinhi/video/7356098366729751816,23,1991,259,119600,719,51,", fyp, goclamdep, reviewlamdep, reviewmypham, swatches, swatchson, makeup, lipgloss, hourglass, hourglasscosmetics, xuhuong, viral",False,False,khietnhinhi,False,False,False,2,12,20,0,1,0,0,0,0,False
"Gần 30 mới bắt đầu dùng mặt nạ mắt 🥹🙃 #abib #abibus #abibeyepatch #eyecare #puffyeyes  #darkcircles #veganskincare @Abib Global #fyp #goclamdep #reviewlamdep #mypham #duongda #chamsocda #skincare #koreanskincare #kbeauty #amazonfavorites
 #viralskincare #skincaretok #glassskin #glowyskin",2024-04-09 13:14:25,09/04/2024,False,https://www.tiktok.com/@khietnhinhi,original sound - khietnhi,7355746822381619985,https://www.tiktok.com/@khietnhinhi/video/7355746790886542600,23,425,33,40100,158,15,"abib, abibus, abibeyepatch, eyecare, puffyeyes, darkcircles, veganskincare, , fyp, goclamdep, reviewlamdep, mypham, duongda, chamsocda, skincare, koreanskincare, kbeauty, amazonfavorites, viralskincare, skincaretok, glassskin, glowyskin",False,False,khietnhinhi,False,False,False,1,21,11,0,0,1,0,0,0,False
Well I have to post this right away it’s tooooo cute tho😭😭😭😭 @Patrick Ta Beauty @patrick ta #fyp #blush #goclamdep #reviewlamdep #mypham #patrickta #patricktabeauty #patricktablush #nottoomuch #swatches ,2024-04-08 23:37:40,08/04/2024,False,https://www.tiktok.com/@khietnhinhi,braincells,7182617118596892674,https://www.tiktok.com/@khietnhinhi/video/7355536317746269447,26,1802,252,125300,355,120,", , fyp, blush, goclamdep, reviewlamdep, mypham, patrickta, patricktabeauty, patricktablush, nottoomuch, swatches",False,False,khietnhinhi,False,False,False,1,10,17,0,0,0,0,1,0,False
Kem chống nắng không nâng tone nè / A broad spectrum sunscreen with no white cast 🧡@somebymi.official #somebymi #koreanskincare #skincareroutine #koreansunscreen #v10hyalairfitsunscreen #glassskin #fyp #goclamdep #reviewlamdep #mypham #chongnang #skincare ,2024-04-08 11:16:52,08/04/2024,True,https://www.tiktok.com/@khietnhinhi,That Couch Potato Again,7239756792690296833,https://www.tiktok.com/@khietnhinhi/video/7355345410040384776,33,3826,238,3700000,152,28,", somebymi, koreanskincare, skincareroutine, koreansunscreen, v10hyalairfitsunscreen, glassskin, fyp, goclamdep, reviewlamdep, mypham, chongnang, skincare",False,False,khietnhinhi,False,False,False,1,12,17,0,1,0,0,0,0,False
I lava you 🧸🎀 mauve chaos 19 #peripera #gloss #liptint #goclamdep #reviewlamdep #mypham #swatches #xuhuong #viral @Peripera ,2024-04-07 22:14:30,07/04/2024,False,https://www.tiktok.com/@khietnhinhi,omg,7247982484036586282,https://www.tiktok.com/@khietnhinhi/video/7355143790748880136,5,208,16,26300,50,5,"peripera, gloss, liptint, goclamdep, reviewlamdep, mypham, swatches, xuhuong, viral, ",False,False,khietnhinhi,False,False,False,1,9,7,0,0,0,0,1,1,False
@Estée Lauder 7 Wonders in a Bottle 🤎✨ serum chống lão hoá quốc dân 💫 @Community X SEEN #goclamdep #reviewlamdep #mypham #skincare #EsteeLauder #WakeUpReady #GiftedbyEstee #Communityxseen #xuhuong #viral #fyp ,2024-04-07 11:23:25,07/04/2024,False,https://www.tiktok.com/@khietnhinhi,Obsessed with Night Peptides Vogue x Estée Lauder,7345848494114032414,https://www.tiktok.com/@khietnhinhi/video/7354976010820914439,22,132,3,5835,9,8,", , goclamdep, reviewlamdep, mypham, skincare, EsteeLauder, WakeUpReady, GiftedbyEstee, Communityxseen, xuhuong, viral, fyp",False,False,khietnhinhi,False,False,False,2,11,16,0,1,0,0,0,1,False
Brand yêu thích & line yêu thích của t. Da đang gặp vấn đề mà dùng Cicapair của Dr.Jart+ là hiểu ngay 🙏🏻 #fyp #goclamdep #reviewlamdep #mypham #skincare #drjart #cicapair #skincareroutine #xuhuong #viral ,2024-04-05 19:45:28,05/04/2024,False,https://www.tiktok.com/@khietnhinhi,original sound,7334779717684185861,https://www.tiktok.com/@khietnhinhi/video/7354363223086320903,0,101,2,12500,30,4,"fyp, goclamdep, reviewlamdep, mypham, skincare, drjart, cicapair, skincareroutine, xuhuong, viral",True,False,khietnhinhi,False,False,False,1,10,22,0,0,0,1,0,0,False
29 tuổi và kẻ bọng mắt với judydoll :)) #fyp #goclamdep #reviewlamdep #mypham #judydoll #contour #xuhuong #viral #tutorial #makeup ,2024-04-05 13:19:08,05/04/2024,False,https://www.tiktok.com/@khietnhinhi,MOKKOJI Kitchen,7026962941702309889,https://www.tiktok.com/@khietnhinhi/video/7354263666042080519,56,1752,34,68900,501,23,"fyp, goclamdep, reviewlamdep, mypham, judydoll, contour, xuhuong, viral, tutorial, makeup",False,False,khietnhinhi,False,False,False,0,10,9,0,0,1,0,0,0,False
Ôi xinh quáaaaaaaa điiiii floofly matte balm #fyp #goclamdep #reviewlamdep #aou #mypham #swatches #glossylips #xuhuong #viral ,2024-04-04 21:46:33,04/04/2024,False,https://www.tiktok.com/@khietnhinhi,Città vuota,7067105848618649602,https://www.tiktok.com/@khietnhinhi/video/7354023345345678610,40,1595,120,111500,618,13,"fyp, goclamdep, reviewlamdep, aou, mypham, swatches, glossylips, xuhuong, viral",False,False,khietnhinhi,False,False,False,0,9,7,0,0,0,1,0,0,False
Thêm 1 em KCN thích hợp cho mùa nóng nực ☀️🥵🔥 #makeprem #makepremvn #chongnang #kcn #fyp #skincare #reviewlamdep #goclamdep #mypham #xuhuong #viral ,2024-04-04 12:33:07,04/04/2024,True,https://www.tiktok.com/@khietnhinhi,Pop beat BGM / long version(1283324),7133303460480419841,https://www.tiktok.com/@khietnhinhi/video/7353880727047408903,45,109,9,13900,14,1,"makeprem, makepremvn, chongnang, kcn, fyp, skincare, reviewlamdep, goclamdep, mypham, xuhuong, viral",False,False,khietnhinhi,False,False,True,2,11,11,0,0,1,0,0,0,False
Chờ bao lâu để ẻm in stock lại mua :)) mi giống idol em mi này dàiiiii nhaaaa #fyp #elyzza #migia #idol #eyelashes #reviewlamdep #goclamdep #mypham #xuhuong #viral ,2024-04-03 15:37:20,03/04/2024,True,https://www.tiktok.com/@khietnhinhi,พี่ชอบหนูที่สุดเลย (I Like You The Most) (Speed Up),7296136277207730178,https://www.tiktok.com/@khietnhinhi/video/7353557100871666962,39,4232,320,1000000,867,91,"fyp, elyzza, migia, idol, eyelashes, reviewlamdep, goclamdep, mypham, xuhuong, viral",False,False,khietnhinhi,False,False,False,0,10,18,0,0,1,0,0,0,False
More more more more glow plssssss #glowskin #glowyskin #reviewlamdep #glassskin #goclamdep #hince #makeup #highlight #fyp #mypham @,2024-04-02 15:21:57,02/04/2024,False,https://www.tiktok.com/@khietnhinhi,Lowkey By Niki,7070726537959443226,https://www.tiktok.com/@khietnhinhi/video/7353182058446982408,17,1799,54,44000,134,20,"glowskin, glowyskin, reviewlamdep, glassskin, goclamdep, hince, makeup, highlight, fyp, mypham",False,False,khietnhinhi,False,False,False,0,10,7,0,0,1,0,0,0,False
"Replying to @Xxs.b.212 Chanel Rouge Allure Velvet Nuit Blanche 06:00
Dạo nì flop quá thật bùn #lipstick #makeup #fyp #chanelbeauty #GocLamDep #reviewlamdep #mypham #sondep #swatches #tryon ",2024-04-01 21:36:51,01/04/2024,False,https://www.tiktok.com/@khietnhinhi,love maybe nightcore,7078263139946547994,https://www.tiktok.com/@khietnhinhi/video/7352907593087487240,22,1259,117,110300,325,99,", lipstick, makeup, fyp, chanelbeauty, goclamdep, reviewlamdep, mypham, sondep, swatches, tryon",False,False,khietnhinhi,False,False,False,0,10,16,0,0,0,1,0,0,False
Makeup with one lipstick (lip pot instead😝) 👄 @fwee_makeup #lipstick #makeup #fyp #lipstickhack #makeuphacks #GocLamDep #reviewlamdep #mypham ,2024-04-01 11:55:22,01/04/2024,False,https://www.tiktok.com/@khietnhinhi,ZiGZaG speed up,7310160204639898400,https://www.tiktok.com/@khietnhinhi/video/7352757734732729618,34,496,44,43600,187,10,", lipstick, makeup, fyp, lipstickhack, makeuphacks, goclamdep, reviewlamdep, mypham",False,False,khietnhinhi,False,False,False,2,8,8,0,1,0,0,0,0,False
"Tưởng làm tiktok giới thiệu sp đồ này kia ha. Rốt cuộc người bị thao túng nhiều hơn là tui 🙏🏻 bị @z_angg  thao túng 2 bé son này 🤣

#GocLamDep #reviewlamdep #reviewmypham #dasique #mypham #sonbong #swatches ",2024-03-31 22:24:45,31/03/2024,False,https://www.tiktok.com/@khietnhinhi,nhạc nền - 𝘏𝘰𝘢𝘯𝘨 𝘈𝘯𝘩𝘩🎧,7325077288612039426,https://www.tiktok.com/@khietnhinhi/video/7352548844229446920,9,181,2,11600,15,15,", goclamdep, reviewlamdep, reviewmypham, dasique, mypham, sonbong, swatches",False,False,khietnhinhi,False,False,False,2,7,28,0,0,0,0,1,1,False
@fwee_makeup mellow dual blush 💫✨ xinh lắm í #GocLamDep #reviewlamdep #reviewmypham #blush #tryon #swatches ,2024-03-30 21:19:10,30/03/2024,False,https://www.tiktok.com/@khietnhinhi,rose speed song,7139184974418823963,https://www.tiktok.com/@khietnhinhi/video/7352160849462709511,36,1257,141,108000,292,27,", goclamdep, reviewlamdep, reviewmypham, blush, tryon, swatches",False,False,khietnhinhi,False,False,False,1,6,7,0,0,0,1,0,1,False
Cocoon did it again với Sữa chống nắng bí đao!!! 😤🌱 #GocLamDep #kemchongnang #cocoon #reviewlamdep #reviewmypham #chongnangthuanchay #skincare #xuhuong #viral ,2024-03-30 14:54:05,30/03/2024,True,https://www.tiktok.com/@khietnhinhi,original sound - khietnhi,7352061665653115664,https://www.tiktok.com/@khietnhinhi/video/7352061615933590802,62,155,13,28100,21,13,"goclamdep, kemchongnang, cocoon, reviewlamdep, reviewmypham, chongnangthuanchay, skincare, xuhuong, viral",False,False,khietnhinhi,False,False,False,1,9,10,0,0,1,0,0,1,False
"Hỡi các đồng môn 1 day 1 mask của tôi ơi #GocLamDep #LearnOnTiktok #reviewlamdep #reviewmypham #mask #skincare #xuhuong #viral #THEFACESHOPCleanBeauty #ThefaceshopVietnam #ThefaceshopSBD
#thefaceshop2024 ",2024-03-29 12:32:38,29/03/2024,False,https://www.tiktok.com/@khietnhinhi,original sound - khietnhi,7351654255402535682,https://www.tiktok.com/@khietnhinhi/video/7351654080831393032,40,122,4,12100,8,6,"goclamdep, learnontiktok, reviewlamdep, reviewmypham, mask, skincare, xuhuong, viral, thefaceshopcleanbeauty, thefaceshopvietnam, thefaceshopsbd, thefaceshop2024",False,False,khietnhinhi,False,False,False,0,12,11,0,0,1,0,0,0,False
Chanel rouge allure lacque 63 Ultimate !!!! #GocLamDep #LearnOnTiktok #reviewlamdep #reviewmypham #chanelbeauty #swatches #xuhuong #viral ,2024-03-26 11:55:15,26/03/2024,False,https://www.tiktok.com/@khietnhinhi,som original,7253840148327975686,https://www.tiktok.com/@khietnhinhi/video/7350531190916517138,25,678,105,72500,315,22,"goclamdep, learnontiktok, reviewlamdep, reviewmypham, chanelbeauty, swatches, xuhuong, viral",False,False,khietnhinhi,False,False,False,0,8,7,0,1,0,0,0,0,False
Tại tui thích trend lan hồ điệp đc chưa 🔪 #GocLamDep #LearnOnTiktok #reviewlamdep #reviewmypham #lanhodiep #makeup #douyinmakeup #xuhuong #viral ,2024-03-25 14:57:18,25/03/2024,False,https://www.tiktok.com/@khietnhinhi,original sound - bubutranxoxo,7340226826805693186,https://www.tiktok.com/@khietnhinhi/video/7350207014032641298,8,563,6,15900,33,9,"goclamdep, learnontiktok, reviewlamdep, reviewmypham, lanhodiep, makeup, douyinmakeup, xuhuong, viral",False,False,khietnhinhi,False,False,False,1,9,9,0,0,1,0,0,0,False
E Cushion đúng chân ái luôn á trờiiii ơi #GocLamDep #LearnOnTiktok #reviewlamdep #reviewmypham #cushion #thehistoryofwhoo #makeuptutorial #tryon #xuhuong #viral #glowymakeup ,2024-03-24 19:14:16,24/03/2024,False,https://www.tiktok.com/@khietnhinhi,how you get the girl,7110623811699002114,https://www.tiktok.com/@khietnhinhi/video/7349902164208274696,61,436,96,59000,125,86,"goclamdep, learnontiktok, reviewlamdep, reviewmypham, cushion, thehistoryofwhoo, makeuptutorial, tryon, xuhuong, viral, glowymakeup",False,False,khietnhinhi,False,False,False,0,11,9,0,0,0,1,0,1,False
The new Patrick Ta blush is….Just Enough💖 #GocLamDep #LearnOnTiktok #reviewlamdep #reviewmypham #patrickta #patricktabeauty #blush #xuhuong #viral #swatches #tryon ,2024-03-24 10:15:18,24/03/2024,False,https://www.tiktok.com/@khietnhinhi,origineel geluid,7273537731446590240,https://www.tiktok.com/@khietnhinhi/video/7349763256652811528,28,3422,624,159100,674,124,"goclamdep, learnontiktok, reviewlamdep, reviewmypham, patrickta, patricktabeauty, blush, xuhuong, viral, swatches, tryon",False,False,khietnhinhi,False,False,False,1,11,7,0,1,0,0,0,1,False
Trend gì mà mê quá dậy 😂 #GocLamDep #LearnOnTiktok #reviewlamdep #reviewmypham #douyinmakeup #xuhuong #viral #makeup ,2024-03-23 19:04:34,23/03/2024,False,https://www.tiktok.com/@khietnhinhi,som original,7276674377964358406,https://www.tiktok.com/@khietnhinhi/video/7349528572312194311,0,568,6,13900,41,23,"GocLamDep, LearnOnTiktok, reviewlamdep, reviewmypham, douyinmakeup, xuhuong, viral, makeup",True,False,khietnhinhi,False,False,True,1,8,6,0,0,0,1,0,1,False
Thử cushion Mistine mà mn khen quá trời nè #GocLamDep #LearnOnTiktok #reviewlamdep #reviewmypham #thuvienmakeup #cushion #mistine #xuhuong #viral ,2024-03-23 11:03:45,23/03/2024,True,https://www.tiktok.com/@khietnhinhi,original sound - khietnhi,7349404707972074241,https://www.tiktok.com/@khietnhinhi/video/7349404654486310162,38,1044,94,157400,163,271,"goclamdep, learnontiktok, reviewlamdep, reviewmypham, thuvienmakeup, cushion, mistine, xuhuong, viral",False,False,khietnhinhi,False,False,False,0,9,9,0,1,0,0,0,1,False
