text,createTime,createTimeISO,isAd,profileUrl,musicName,musicId,webVideoUrl,duration,diggCount,shareCount,playCount,collectCount,commentCount,hashtags,isSlideshow,isSponsored,kol_username,ttSeller,commerceUser,is_trending,emoji_count,hashtag_count,word_count_no_emoji_hashtag,early_morning,morning,afternoon,evening,late_night,is_weekend,is_pinned
Mùa đông không trời âm u thì vẫn phải chống nắng như thường nhaaaa #goclamdep #beautytok  #kemchongnang #sunscreen #SuperUV #garnier #garniervn #thaodoanmakeup ,2024-12-10 19:02:04,10/12/2024,False,https://www.tiktok.com/@rosermae,original sound - Thảo Đoàn,7446752333105138448,https://www.tiktok.com/@rosermae/video/7446752256025840914,38,2142,23,155600,80,31,"goclamdep, beautytok, kemchongnang, sunscreen, superuv, garnier, garniervn, thaodoanmakeup",False,False,rosermae,False,True,False,0,8,14,0,0,0,1,0,0,False
Mùa đông mà k thử mấy màu son ntn thì phí lắm #thaodoanmakeup #beautytok #reviewlamdep #makeuptips #learnontiktok  #thuvienmakeup #maybelline,2024-12-09 20:08:47,09/12/2024,False,https://www.tiktok.com/@rosermae,original sound - Thảo Đoàn,7446398395570326289,https://www.tiktok.com/@rosermae/video/7446398360833068306,86,7881,158,356600,1203,108,"thaodoanmakeup, beautytok, reviewlamdep, makeuptips, learnontiktok, thuvienmakeup, maybelline",False,False,rosermae,False,True,True,0,7,12,0,0,0,1,0,0,False
Lướt một cái là như bật filter cà mịn vân môi luôn ý #thaodoanmakeup #beautytok #reviewlamdep #makeuptips #learnontiktok #judydoll #lipcreampowder ,2024-12-07 15:43:51,07/12/2024,True,https://www.tiktok.com/@rosermae,original sound - Thảo Đoàn,7445587946180315920,https://www.tiktok.com/@rosermae/video/7445587917986073863,53,2708,117,312100,493,42,"thaodoanmakeup, beautytok, reviewlamdep, makeuptips, learnontiktok, judydoll, lipcreampowder",False,True,rosermae,False,True,False,0,7,13,0,0,1,0,0,1,False
Nó tiện lắm ý #thaodoanmakeup #beautytok #reviewlamdep #makeuptips #learnontiktok ,2024-12-05 10:23:09,05/12/2024,False,https://www.tiktok.com/@rosermae,original sound - Thảo Đoàn,7444763255517596417,https://www.tiktok.com/@rosermae/video/7444763095458729224,80,43300,647,857900,8854,126,"thaodoanmakeup, beautytok, reviewlamdep, makeuptips, learnontiktok",False,False,rosermae,False,True,False,0,5,4,0,1,0,0,0,0,False
Lâu lắm rồi mới tìm được mấy màu son đậm vibe thu đông như thế này 🤌🤌🤌 #thaodoanmakeup #beautytok #reviewlamdep #makeuptips #learnontiktok #thuvienmakeup ,2024-12-01 21:16:09,01/12/2024,False,https://www.tiktok.com/@rosermae,original sound - Thảo Đoàn,7443447388414839553,https://www.tiktok.com/@rosermae/video/7443447037795798280,69,1362,45,156900,148,35,"thaodoanmakeup, beautytok, reviewlamdep, makeuptips, learnontiktok, thuvienmakeup",False,False,rosermae,False,True,True,1,6,16,0,0,0,1,0,1,False
Mấy màu mới đều xinh xỉu 😭 kiểu mlbb nhẹ nhàng đi học đi làm đi chơi đều được ý #thaodoanmakeup #beautytok #reviewlamdep #makeuptips #learnontiktok #EspoirVN #TintGlaze ,2024-11-30 18:05:46,30/11/2024,False,https://www.tiktok.com/@rosermae,Forest,7386916118848112657,https://www.tiktok.com/@rosermae/video/7443026896339619080,78,1625,23,142900,174,22,"thaodoanmakeup, beautytok, reviewlamdep, makeuptips, learnontiktok, espoirvn, tintglaze",False,False,rosermae,False,True,False,1,7,19,0,0,0,1,0,1,False
Cuối cùng nền này cũng comeback rùi #thaodoanmakeup #beautytok #reviewlamdep #makeuptips #learnontiktok #kemnennapdo #lorealparis ,2024-11-26 18:59:05,26/11/2024,False,https://www.tiktok.com/@rosermae,original sound - Thảo Đoàn,7441556323667364625,https://www.tiktok.com/@rosermae/video/7441556292541467922,124,16900,629,728900,2671,882,"thaodoanmakeup, beautytok, reviewlamdep, makeuptips, learnontiktok, kemnennapdo, lorealparis",False,False,rosermae,False,True,False,0,7,7,0,0,0,1,0,0,False
Đánh nền xong dùng bút tạo khối rồi mới phủ phấn nha #thaodoanmakeup #beautytok #reviewlamdep #makeuptips #learnontiktok #longervideos #outofoffice #ooo ,2024-11-24 18:26:07,24/11/2024,False,https://www.tiktok.com/@rosermae,original sound - Thảo Đoàn,7440805835732830977,https://www.tiktok.com/@rosermae/video/7440805631352720658,107,4112,119,148000,1861,34,"thaodoanmakeup, beautytok, reviewlamdep, makeuptips, learnontiktok, longervideos, outofoffice, ooo",False,False,rosermae,False,True,False,0,8,12,0,0,0,1,0,1,False
Chăm tẩy da chết thì sẽ ít bị mốc với bong tróc da nha #thaodoanmakeup #beautytok #reviewlamdep #makeuptips #learnontiktok #drg #drgvietnam #taydachet ,2024-11-20 19:20:45,20/11/2024,True,https://www.tiktok.com/@rosermae,original sound - Thảo Đoàn,7439335518438968081,https://www.tiktok.com/@rosermae/video/7439335368022854919,71,2145,51,204600,374,64,"thaodoanmakeup, beautytok, reviewlamdep, makeuptips, learnontiktok, drg, drgvietnam, taydachet",False,True,rosermae,False,True,False,0,8,14,0,0,0,1,0,0,False
Ai thích make kiểu hồng lạnh thì tham khảo em này nhó dễ dùng lắm #thaodoanmakeup #beautytok #reviewlamdep #makeuptips #learnontiktok #fitme #thuvienmakeup ,2024-11-18 20:45:11,18/11/2024,False,https://www.tiktok.com/@rosermae,original sound - Thảo Đoàn,7438616098871741201,https://www.tiktok.com/@rosermae/video/7438614953403108615,42,9266,184,415200,1176,66,"thaodoanmakeup, beautytok, reviewlamdep, makeuptips, learnontiktok, fitme, thuvienmakeup",False,True,rosermae,False,True,False,0,7,15,0,0,0,1,0,0,False
Mình dùng em này đến nay cũng đc tầm 6-7 năm rồi 👌 mê ạ #thaodoanmakeup #beautytok #reviewlamdep #makeuptips #learnontiktok #CicaplastBaumeB5 #ChuyenGiaChuaLanh #LaRochePosay #LaRochePosayVietNam  ,2024-11-15 20:02:16,15/11/2024,False,https://www.tiktok.com/@rosermae,original sound - Thảo Đoàn,7437490664718535440,https://www.tiktok.com/@rosermae/video/7437490632165281031,51,8096,55,583700,452,59,"thaodoanmakeup, beautytok, reviewlamdep, makeuptips, learnontiktok, cicaplastbaumeb5, chuyengiachualanh, larocheposay, larocheposayvietnam",False,True,rosermae,False,True,False,1,9,14,0,0,0,1,0,0,False
Ngon bổ rẻ chất lượng ổn áp nha #thaodoanmakeup #beautytok #reviewlamdep #makeuptips #learnontiktok #zeesea ,2024-11-14 18:13:22,14/11/2024,False,https://www.tiktok.com/@rosermae,original sound - Thảo Đoàn,7437091512259398417,https://www.tiktok.com/@rosermae/video/7437091491467529480,36,4041,105,283100,423,31,"thaodoanmakeup, beautytok, reviewlamdep, makeuptips, learnontiktok, zeesea",False,False,rosermae,False,True,False,0,6,8,0,0,0,1,0,0,False
Lần đầu tiên dùng cọ son mát lạnh ntn luôn 😆 #thaodoanmakeup #beautytok #reviewlamdep #makeuptips #learnontiktok #judydoll #icewaterylipgloss ,2024-11-13 18:24:40,13/11/2024,True,https://www.tiktok.com/@rosermae,original sound - Thảo Đoàn,7436723416985717520,https://www.tiktok.com/@rosermae/video/7436723318067055890,42,6577,150,354900,616,83,"thaodoanmakeup, beautytok, reviewlamdep, makeuptips, learnontiktok, judydoll, icewaterylipgloss",False,False,rosermae,False,True,False,1,7,10,0,0,0,1,0,0,False
Cứu rỗi cho làn da vừa dầu vừa khô 🥲 #thaodoanmakeup #beautytok #reviewlamdep #makeuptips #learnontikto #carslan #kemnen ,2024-11-10 20:28:55,10/11/2024,True,https://www.tiktok.com/@rosermae,original sound - Thảo Đoàn,7435642119710083841,https://www.tiktok.com/@rosermae/video/7435642067889589522,141,24100,761,966500,2901,1560,"thaodoanmakeup, beautytok, reviewlamdep, makeuptips, learnontikto, carslan, kemnen",False,False,rosermae,False,True,False,1,7,9,0,0,0,1,0,1,False
Phấn này cà mịn da đỉnh cao lắm nè =)) #thaodoanmakeup #beautytok #reviewlamdep #makeuptips #learnontiktok #longervideos ,2024-11-09 12:19:00,09/11/2024,True,https://www.tiktok.com/@rosermae,original sound - Thảo Đoàn,7435144900365290256,https://www.tiktok.com/@rosermae/video/7435144711356075285,149,20000,408,759400,2247,171,"thaodoanmakeup, beautytok, reviewlamdep, makeuptips, learnontiktok, longervideos",False,False,rosermae,False,True,False,0,6,10,0,0,1,0,0,1,False
Muốn đánh son bóng đẹp thì nên học cách dùng chì kẻ môi nha #thaodoanmakeup #beautytok #reviewlamdep #makeuptips #learnontiktok ,2024-11-08 20:00:39,08/11/2024,False,https://www.tiktok.com/@rosermae,original sound - Thảo Đoàn,7434892761679104784,https://www.tiktok.com/@rosermae/video/7434892614643518740,65,3050,66,151500,562,41,"thaodoanmakeup, beautytok, reviewlamdep, makeuptips, learnontiktok",False,False,rosermae,False,True,False,0,5,14,0,0,0,1,0,0,False
Replying to @୨ৎ Daisy ୨ৎ cách đánh nền căng bóng mà vẫn phủ đc phấn đây nhaaaa #thaodoanmakeup #beautytok #reviewlamdep #makeuptips #learnontiktok #glintbyvdivov #glinthighlighter ,2024-11-06 21:04:49,06/11/2024,False,https://www.tiktok.com/@rosermae,original sound - Thảo Đoàn,7434167022495288080,https://www.tiktok.com/@rosermae/video/7434166974940220693,104,3132,41,136400,496,30,", thaodoanmakeup, beautytok, reviewlamdep, makeuptips, learnontiktok, glintbyvdivov, glinthighlighter",False,False,rosermae,False,True,False,0,7,17,0,0,0,1,0,0,False
Kem chống nắng dưỡng ẩm vừa budget cho mọi nhà nè #superUV #thaodoanmakeup #beautytok #reviewlamdep #makeuptips ,2024-11-05 19:53:54,05/11/2024,False,https://www.tiktok.com/@rosermae,original sound - Thảo Đoàn,7433777723262880513,https://www.tiktok.com/@rosermae/video/7433777618975051024,41,1736,39,114300,147,26,"superuv, thaodoanmakeup, beautytok, reviewlamdep, makeuptips",False,False,rosermae,False,True,False,0,5,11,0,0,0,1,0,0,False
Thêm 1 kiến thức hay ho ở lớp share cho mấy bà nè #thaodoanmakeup #beautytok #reviewlamdep #makeuptips ,2024-11-02 20:43:38,02/11/2024,False,https://www.tiktok.com/@rosermae,original sound - Thảo Đoàn,7432677219173944080,https://www.tiktok.com/@rosermae/video/7432677177935678741,96,41600,800,868600,11600,167,"thaodoanmakeup, beautytok, reviewlamdep, makeuptips",False,False,rosermae,False,True,False,0,4,13,0,0,0,1,0,1,False
Makeup chụp ảnh Zanhua bên này đang hot lắm nè #thaodoanmakeup #beautytok #reviewlamdep #makeuptips #pramy #xịtcốđịnhlớptrangđiểm #lockinyourbeauty ,2024-10-31 19:59:23,31/10/2024,True,https://www.tiktok.com/@rosermae,original sound - Thảo Đoàn,7431923647138630401,https://www.tiktok.com/@rosermae/video/7431923613004991761,47,7127,94,289000,496,90,"thaodoanmakeup, beautytok, reviewlamdep, makeuptips, pramy, xịtcốđịnhlớptrangđiểm, lockinyourbeauty",False,False,rosermae,False,True,False,0,7,10,0,0,0,1,0,0,False
Makeup đơn giản để ban ngày đi học đi làm tối vẫn đi quẩy đc Halloween nè #thaodoanmakeup #beautytok #reviewlamdep #makeuptips #halloweenmakeup #Shopee2School #ShopeeNewGenClub,2024-10-28 18:20:06,28/10/2024,True,https://www.tiktok.com/@rosermae,"Halloween, club, dark, night, party(891135)",6895807664110962690,https://www.tiktok.com/@rosermae/video/7430784755991350535,64,2231,86,148600,214,19,"thaodoanmakeup, beautytok, reviewlamdep, makeuptips, halloweenmakeup, Shopee2School, ShopeeNewGenClub",False,False,rosermae,False,True,True,0,7,17,0,0,0,1,0,0,False
"Màu số 5, màu số 5, màu số 5. Điều gì quan trọng mình phải nhắc lại 3 lần 😌 #thaodoanmakeup #beautytok #reviewlamdep #makeuptips #Tocobo #TocoboVN #LipOil#JuicyBerryPlumping ",2024-10-26 20:43:43,26/10/2024,False,https://www.tiktok.com/@rosermae,original sound - Thảo Đoàn,7430079840281922321,https://www.tiktok.com/@rosermae/video/7430079596084645128,115,5304,87,202700,344,41,"thaodoanmakeup, beautytok, reviewlamdep, makeuptips, tocobo, tocobovn, lipoil, juicyberryplumping",False,False,rosermae,False,True,False,1,8,19,0,0,0,1,0,1,False
Có thể tận dụng má hồng kem thay triệt sắc nha #thaodoanmakeup #beautytok #reviewlamdep #learnontiktok #ShopeeLamDep ,2024-10-25 12:50:59,25/10/2024,True,https://www.tiktok.com/@rosermae,original sound - Thảo Đoàn,7429586763833854721,https://www.tiktok.com/@rosermae/video/7429586678219689237,87,2646,51,228500,542,21,"thaodoanmakeup, beautytok, reviewlamdep, learnontiktok, shopeelamdep",False,False,rosermae,False,True,False,0,5,11,0,0,1,0,0,0,False
"Cứu tinh cho da tui huhu #thaodoanmakeup #beautytok #reviewlamdep #LaRochePosayVN #MelaB3 #LaRochePosay
#deptienphong
#GoldenStella4evr ",2024-10-24 19:44:28,24/10/2024,False,https://www.tiktok.com/@rosermae,original sound - Thảo Đoàn,7429322199057697537,https://www.tiktok.com/@rosermae/video/7429322161782885648,95,12900,56,393200,461,47,"thaodoanmakeup, beautytok, reviewlamdep, larocheposayvn, melab3, larocheposay, deptienphong, goldenstella4evr",False,False,rosermae,False,True,False,0,8,6,0,0,0,1,0,0,False
🎃 #thaodoanmakeup #beautytok #reviewlamdep #halloweenmakeup ,2024-10-22 18:22:44,22/10/2024,False,https://www.tiktok.com/@rosermae,Drake of the Fates,7066808094130719535,https://www.tiktok.com/@rosermae/video/7428558942516563207,12,2347,10,108100,23,20,"thaodoanmakeup, beautytok, reviewlamdep, halloweenmakeup",False,False,rosermae,False,True,True,1,4,0,0,0,0,1,0,0,False
Chòi oi nó xinhhhh #thaodoanmakeup #ofelia #beautytok ,2024-10-19 18:45:32,19/10/2024,True,https://www.tiktok.com/@rosermae,original sound - Thảo Đoàn,7427451752405945104,https://www.tiktok.com/@rosermae/video/7427451545995709716,92,29400,910,2100000,6083,186,"thaodoanmakeup, ofelia, beautytok",False,False,rosermae,False,True,False,0,3,4,0,0,0,1,0,1,False
Ai cứ hỏi tui kem nâng tông thì đây nha #learnontiktok #thaodoanmakeup #beautytok #reviewlamdep #makeuptips #kemnangtone ,2024-10-18 21:43:47,18/10/2024,True,https://www.tiktok.com/@rosermae,original sound - Thảo Đoàn,7427126451000494864,https://www.tiktok.com/@rosermae/video/7427126386764156180,127,37600,1060,1200000,7049,665,"learnontiktok, thaodoanmakeup, beautytok, reviewlamdep, makeuptips, kemnangtone",False,False,rosermae,False,True,False,0,6,10,0,0,0,1,0,0,False
Vội ra ngoài mang mỗi thỏi son vẫn make được ngon ơ nha #learnontiktok #thaodoanmakeup #beautytok #reviewlamdep #makeuptips #teddytint #sonbonggaughien #thuvienmakeup ,2024-10-17 13:16:30,17/10/2024,False,https://www.tiktok.com/@rosermae,original sound - Thảo Đoàn,7426624645136272145,https://www.tiktok.com/@rosermae/video/7426624562676239636,50,4583,117,229700,1013,92,"learnontiktok, thaodoanmakeup, beautytok, reviewlamdep, makeuptips, teddytint, sonbonggaughien, thuvienmakeup",False,False,rosermae,False,True,False,0,8,13,0,0,1,0,0,0,False
Nền mướt cực lunnn #learnontiktok #thaodoanmakeup #beautytok #reviewlamdep #makeuptips #dalbavn #dalbavietnam #dalba ,2024-10-14 18:45:46,14/10/2024,False,https://www.tiktok.com/@rosermae,original sound - Thảo Đoàn,7425596324223568641,https://www.tiktok.com/@rosermae/video/7425596199228411144,61,10200,117,237400,1590,81,"learnontiktok, thaodoanmakeup, beautytok, reviewlamdep, makeuptips, dalbavn, dalbavietnam, dalba",False,False,rosermae,False,True,False,0,8,4,0,0,0,1,0,0,False
Giải quyết vấn đề che mãi mà khuyết điểm vẫn lộ ra nè #learnontiktok #thaodoanmakeup #beautytok #reviewlamdep #makeuptips #longervideos ,2024-10-12 12:08:48,12/10/2024,False,https://www.tiktok.com/@rosermae,original sound - Thảo Đoàn,7424751761732225809,https://www.tiktok.com/@rosermae/video/7424751728668445959,106,35400,1127,730100,12100,284,"learnontiktok, thaodoanmakeup, beautytok, reviewlamdep, makeuptips, longervideos",False,False,rosermae,False,True,False,0,6,13,0,0,1,0,0,1,False
Mn có tò mò về đồ ăn gì ở TQ kkk #learnontiktok #thaodoanmakeup #beautytok #reviewlamdep #makeuptips #teddytint #sonbonggaughien #thuvienmakeup ,2024-10-06 18:58:48,06/10/2024,False,https://www.tiktok.com/@rosermae,original sound - Thảo Đoàn,7422630906361416464,https://www.tiktok.com/@rosermae/video/7422630870143487240,98,3691,22,197900,120,37,"learnontiktok, thaodoanmakeup, beautytok, reviewlamdep, makeuptips, teddytint, sonbonggaughien, thuvienmakeup",False,False,rosermae,False,True,False,0,8,11,0,0,0,1,0,1,False
Giờ tui mới biết cái thuật ngữ lốp sáng này mấy bà ơi 🤣 #learnontiktok #thaodoanmakeup #beautytok #reviewlamdep #makeuptips #longervideos ,2024-10-05 17:36:12,05/10/2024,True,https://www.tiktok.com/@rosermae,original sound - Thảo Đoàn,7422238540027333392,https://www.tiktok.com/@rosermae/video/7422238506778512658,138,10100,185,276500,904,51,"learnontiktok, thaodoanmakeup, beautytok, reviewlamdep, makeuptips, longervideos",False,False,rosermae,False,True,False,1,6,13,0,0,1,0,0,1,False
Mẹ tui gu nâng tông nên mê em này lắm 😆 #learnontiktok #thaodoanmakeup #beautytok #reviewlamdep #makeuptips #beplainvietnam #kemchongnangbeplain #beplain #sunmuse ,2024-10-04 20:03:52,04/10/2024,True,https://www.tiktok.com/@rosermae,original sound - Thảo Đoàn,7421905516102372112,https://www.tiktok.com/@rosermae/video/7421905476251585799,55,9421,698,816900,975,1574,"learnontiktok, thaodoanmakeup, beautytok, reviewlamdep, makeuptips, beplainvietnam, kemchongnangbeplain, beplain, sunmuse",False,False,rosermae,False,True,False,1,9,10,0,0,0,1,0,0,False
Kiểu này chính là dành cho mấy bà kẹp mi mãi không cong đây =))))) #learnontiktok #thaodoanmakeup #beautytok #reviewlamdep #makeuptips ,2024-10-02 20:13:16,02/10/2024,False,https://www.tiktok.com/@rosermae,That Couch Potato Again,7239756792690296833,https://www.tiktok.com/@rosermae/video/7421165715807276296,46,10100,139,273800,2068,36,"learnontiktok, thaodoanmakeup, beautytok, reviewlamdep, makeuptips",False,False,rosermae,False,True,False,0,5,15,0,0,0,1,0,0,False
Mascara ngon bổ rẻ nè mấy bồ #learnontiktok #thaodoanmakeup #beautytok #reviewlamdep #makeuptips #colorkey #colorkeymascara #long&densemascara ,2024-10-01 19:14:27,01/10/2024,True,https://www.tiktok.com/@rosermae,original sound - Thảo Đoàn,7420779512843602704,https://www.tiktok.com/@rosermae/video/7420779488100797714,39,3968,141,216400,398,102,"learnontiktok, thaodoanmakeup, beautytok, reviewlamdep, makeuptips, colorkey, colorkeymascara, long",False,False,rosermae,False,True,False,0,8,8,0,0,0,1,0,0,False
2 màu này da nào đánh cũng xinh nhá #learnontiktok #thaodoanmakeup #beautytok #reviewlamdep #makeuptips #teddytint #sonbonggaughien #thuvienmakeup ,2024-09-30 11:36:37,30/09/2024,False,https://www.tiktok.com/@rosermae,original sound - Thảo Đoàn,7420290446074612481,https://www.tiktok.com/@rosermae/video/7420290407768001799,57,10500,422,577600,1564,287,"learnontiktok, thaodoanmakeup, beautytok, reviewlamdep, makeuptips, teddytint, sonbonggaughien, thuvienmakeup",False,False,rosermae,False,True,False,0,8,9,0,1,0,0,0,0,False
Cái má hồng nó iu lắm huhu must try #learnontiktok #thaodoanmakeup #beautytok #reviewlamdep #makeuptips ,2024-09-25 12:58:10,25/09/2024,True,https://www.tiktok.com/@rosermae,original sound - Thảo Đoàn,7418456063344724753,https://www.tiktok.com/@rosermae/video/7418456002976173330,87,15500,136,1100000,1326,82,"learnontiktok, thaodoanmakeup, beautytok, reviewlamdep, makeuptips",False,False,rosermae,False,True,False,0,5,9,0,0,1,0,0,0,False
Cứ tưởng phải khó dùng lắm cơ ai dè 🤣 #learnontiktok #thaodoanmakeup #beautytok #reviewlamdep #makeuptips #longervideos #Espoir #EspoirVN #BeGlowStick ,2024-09-23 17:44:52,23/09/2024,False,https://www.tiktok.com/@rosermae,original sound - Thảo Đoàn,7417787747655617296,https://www.tiktok.com/@rosermae/video/7417787717964008711,142,17500,500,490800,1589,101,"learnontiktok, thaodoanmakeup, beautytok, reviewlamdep, makeuptips, longervideos, espoir, espoirvn, beglowstick",False,False,rosermae,False,True,False,1,9,9,0,0,1,0,0,0,False
Ai đánh má hồng xong mà bao nhiêu khuyết điểm mất bao nhiêu công che lộ ra hết điểm danh ạ 🙋‍♀️ #learnontiktok #thaodoanmakeup #beautytok #reviewlamdep #makeuptips ,2024-09-22 19:47:57,22/09/2024,False,https://www.tiktok.com/@rosermae,original sound - Thảo Đoàn,7417448427191192321,https://www.tiktok.com/@rosermae/video/7417448348577189128,68,12200,161,280000,2364,73,"learnontiktok, thaodoanmakeup, beautytok, reviewlamdep, makeuptips",False,False,rosermae,False,True,False,2,5,22,0,0,0,1,0,1,False
Cushion này xinh lúm nè #learnontiktok #thaodoanmakeup #beautytok #reviewlamdep #makeuptips ,2024-09-20 12:52:08,20/09/2024,True,https://www.tiktok.com/@rosermae,original sound - Thảo Đoàn,7416599059248515857,https://www.tiktok.com/@rosermae/video/7416599018270182674,110,13900,413,608000,1283,195,"learnontiktok, thaodoanmakeup, beautytok, reviewlamdep, makeuptips",False,False,rosermae,False,True,False,0,5,5,0,0,1,0,0,0,False
Mình chắc là người nước ngoài duy nhất tự ứng cử làm lớp trưởng 🤣 quen đc nhiều bạn lắm rồi sau này quay cho mn #learnontiktok #thaodoanmakeup #beautytok #reviewlamdep #makeuptips #maogeping ,2024-09-18 19:54:35,18/09/2024,False,https://www.tiktok.com/@rosermae,original sound - Thảo Đoàn,7415965768145390337,https://www.tiktok.com/@rosermae/video/7415965714680499464,60,4853,30,167800,226,27,"learnontiktok, thaodoanmakeup, beautytok, reviewlamdep, makeuptips, maogeping",False,False,rosermae,False,True,False,1,6,25,0,0,0,1,0,0,False
"Replying to @hannah:> học cách phủ phấn trước nhe, bài ckđ hơi dài nên tui sẽ edit up sau ạ #learnontiktok #thaodoanmakeup #beautytok #reviewlamdep #makeuptips #longervideos ",2024-09-16 17:35:36,16/09/2024,False,https://www.tiktok.com/@rosermae,original sound - Thảo Đoàn,7415187788011801360,https://www.tiktok.com/@rosermae/video/7415187722513419527,133,9345,224,284600,4104,64,", learnontiktok, thaodoanmakeup, beautytok, reviewlamdep, makeuptips, longervideos",False,False,rosermae,False,True,False,0,6,20,0,0,1,0,0,0,False
"Mọi người cmt tên 1 màu son mới của dòng C hoặc L mọi người muốn trải nghiệm, đến 25/9 mình sẽ chọn ra 3 cmt để brand gửi tặng quà nhaaa #learnontiktok #thaodoanmakeup #beautytok #reviewlamdep #makeuptips #mistine ",2024-09-15 19:49:04,15/09/2024,True,https://www.tiktok.com/@rosermae,original sound - Thảo Đoàn,7414851065813977857,https://www.tiktok.com/@rosermae/video/7414851030900395272,99,2121,46,210900,203,94,"learnontiktok, thaodoanmakeup, beautytok, reviewlamdep, makeuptips, mistine",False,False,rosermae,False,True,True,0,6,32,0,0,0,1,0,1,False
Các bà thích series này k sau này tui đi làm thân với các bạn cùng lớp rồi xin quay ké 🤣 #learnontiktok #thaodoanmakeup #beautytok #reviewlamdep #makeuptips ,2024-09-11 17:58:18,11/09/2024,False,https://www.tiktok.com/@rosermae,original sound - Thảo Đoàn,7413338208659933968,https://www.tiktok.com/@rosermae/video/7413338153655831826,76,36900,290,600000,4108,122,"learnontiktok, thaodoanmakeup, beautytok, reviewlamdep, makeuptips",False,False,rosermae,False,True,False,1,5,21,0,0,1,0,0,0,False
Mua qua link của tui có voucher giảm giá 15k nhớ dùng nhaaaa #learnontiktok #thaodoanmakeup #beautytok #reviewlamdep #makeuptips #miphaleden #mlendiary #mlenvn ,2024-09-09 19:08:40,09/09/2024,True,https://www.tiktok.com/@rosermae,original sound - Thảo Đoàn,7412614153778531088,https://www.tiktok.com/@rosermae/video/7412614082081115408,111,7386,497,711400,1525,175,"learnontiktok, thaodoanmakeup, beautytok, reviewlamdep, makeuptips, miphaleden, mlendiary, mlenvn",False,False,rosermae,False,True,False,0,8,13,0,0,0,1,0,0,False
Bà nào cứ bôi kcn xong đánh nền gặp vấn đề thì vào đây tham khảo nha #learnontiktok #thaodoanmakeup #beautytok #reviewlamdep #makeuptips #invisiblesunscreen #trycosrxspf ,2024-09-07 20:33:33,07/09/2024,False,https://www.tiktok.com/@rosermae,original sound - Thảo Đoàn,7411893848676961040,https://www.tiktok.com/@rosermae/video/7411893814845000977,75,5516,75,373700,763,82,"learnontiktok, thaodoanmakeup, beautytok, reviewlamdep, makeuptips, invisiblesunscreen, trycosrxspf",False,False,rosermae,False,True,False,0,7,17,0,0,0,1,0,1,False
Định up nick phụ thôi mà bực quá phải log acc chính lên combat. Tránh xa cái brand này raaaa mn ơi 🤬🤬🤬 #learnontiktok #thaodoanmakeup #fyp #flortte #photflortte ,2024-09-06 20:56:00,06/09/2024,False,https://www.tiktok.com/@rosermae,original sound - Thảo Đoàn,7411528555542088449,https://www.tiktok.com/@rosermae/video/7411528487112150288,132,125600,15400,2000000,3955,1428,"learnontiktok, thaodoanmakeup, fyp, flortte, photflortte",False,False,rosermae,False,True,False,1,5,22,0,0,0,1,0,0,False
Kiểu rõ ràng các bước giống nhau mà kết quả khác 1 trời 1 vực ý #learnontiktok #beautytok #reviewlamdep #thaodoanmakeup #makeuptips #longervideos ,2024-09-05 11:12:20,05/09/2024,False,https://www.tiktok.com/@rosermae,original sound - Thảo Đoàn,7411007056343321345,https://www.tiktok.com/@rosermae/video/7411006968158014721,169,8684,78,364400,847,51,"learnontiktok, beautytok, reviewlamdep, thaodoanmakeup, makeuptips, longervideos",False,False,rosermae,False,True,False,0,6,16,0,1,0,0,0,0,False
Điểm danh xem các bà mắc bao nhiêu lỗi trong này nào #learnontiktok #beautytok #reviewlamdep #thaodoanmakeup #makeuptips #longervideos ,2024-09-01 17:59:40,01/09/2024,False,https://www.tiktok.com/@rosermae,original sound - Thảo Đoàn,7409627915626990337,https://www.tiktok.com/@rosermae/video/7409627646797057287,129,6139,64,290500,604,42,"learnontiktok, beautytok, reviewlamdep, thaodoanmakeup, makeuptips, longervideos",False,False,rosermae,False,True,False,0,6,12,0,0,1,0,0,1,False
